{"acceptance_owner":"Pavel Obruchnikov <me@inkyquill.net>","blocked_plans":[],"issues":[],"record_digests":{"frontend-embedding":"2115e36ea24177fb05846b1be21dce5a11a12c6479c5e35a2c4ededf1251e666","legacy-database-import":"ef77ae676474a45bbe46ff065f6e987ce74caf7f7f4ce249eb95364af2a3ccb5","mcp-transport":"38e831082f18dca43bce2a426c3a64b647ee202a36ebbcdcb3dc327e7b47edfa","semantic-native":"c8f5a3d1bdb39f8804fe89380808f0cca30c34fa2ed38f267c95244a65322c6a"},"release_mode":"semantic-enabled","schema_version":1,"status":"qualified","target":"x86_64-unknown-linux-gnu"}
